{
  "schema": 1,
  "default_state": "NOT_CONNECTED",
  "note": "Connector definitions only. No credentials or live account/resource grants are committed.",
  "connectors": [
    {
      "schema": 1,
      "id": "google-ads-readonly",
      "provider": "google-ads",
      "label": "Google Ads Read-Only",
      "default_state": "NOT_CONNECTED",
      "capabilities": [
        "ads.google.read",
        "ads.google.insights",
        "ads.google.keywords",
        "ads.google.creative",
        "ads.google.verify"
      ],
      "access_modes": [
        "READ"
      ],
      "resource_types": [
        "google_ads_customer"
      ],
      "auth": {
        "mode": "SECRET_REF_REQUIRED",
        "allowed_ref_prefixes": [
          "connector-secret://",
          "env://",
          "secret://"
        ]
      },
      "verification_method": "Use a reviewed connection evidence reference, exact customer grant, and read-only provider transport; mutation operations are not exposed."
    },
    {
      "schema": 1,
      "id": "playwright-mcp-browser",
      "provider": "playwright-mcp",
      "label": "Playwright MCP Browser",
      "default_state": "NOT_CONNECTED",
      "capabilities": [
        "browser.structured"
      ],
      "access_modes": [
        "READ",
        "WRITE"
      ],
      "resource_types": [
        "browser_origin"
      ],
      "auth": {
        "mode": "NONE",
        "allowed_ref_prefixes": []
      },
      "verification_method": "Use an explicitly connected Playwright MCP transport with a disposable browser profile; every action still requires exact Connector Center and Capability Router authorization."
    },
    {
      "schema": 1,
      "id": "google-places-readonly",
      "provider": "google-places-new",
      "label": "Google Places (New) Read-Only",
      "default_state": "NOT_CONNECTED",
      "capabilities": [
        "geo.places.search",
        "geo.places.details"
      ],
      "access_modes": [
        "READ"
      ],
      "resource_types": [
        "geo_policy_scope"
      ],
      "auth": {
        "mode": "SECRET_REF_REQUIRED",
        "allowed_ref_prefixes": [
          "connector-secret://",
          "env://",
          "secret://"
        ]
      },
      "verification_method": "Use an exact geo policy scope, explicit non-wildcard FieldMask profile, bounded query/area request, ephemeral response handling, and durable Place ID-only retention policy. Connector is definition-only until reviewed live connection evidence exists."
    }
  ]
}
